,Title,Time,Link
130,BNY Mellon Announces Redemption of 2.450% Senior Notes ...,"Oct 13, 2020",https://www.prnewswire.com/news-releases/bny-mellon-announces-redemption-of-2-450-senior-notes-due-2020--301150574.html
131,"Shayne & Co.- Llc Buys Bank of New York Mellon Corp- National Health 
Investors Inc",1 month ago,https://finance.yahoo.com/news/shayne-co-llc-buys-bank-123810730.html
132,Is The Bank of New York Mellon Corporation (NYSE:BK ...,"Jan 10, 2021",https://simplywall.st/stocks/us/diversified-financials/nyse-bk/bank-of-new-york-mellon/news/is-the-bank-of-new-york-mellon-corporation-nysebk-popular-am
133,BNY Mellon OMNI(SM) Selected by Gabelli Funds to Launch ...,1 month ago,https://www.prnewswire.com/news-releases/bny-mellon-omnism-selected-by-gabelli-funds-to-launch-its-new-actively-managed-etf-301224559.html
134,BNY Mellon Wealth Management Names Adam Innerst as ...,"Nov 18, 2020",https://www.prnewswire.com/news-releases/bny-mellon-wealth-management-names-adam-innerst-as-market-president-in-houston-tx-301175934.html
135,A brief guide to China’s stock markets and indices,5 days ago,https://supchina.com/2021/03/08/a-brief-guide-to-chinas-stock-markets-and-indices/
136,BNY Mellon Launches its Automated Payment Solutions ...,"Sep 9, 2020",https://www.prnewswire.com/news-releases/bny-mellon-launches-its-automated-payment-solutions-offering-for-insurance-payers-301126703.html
137,The Bank of New York Mellon Corp. Q4 adjusted earnings Beat Estimates,1 month ago,https://www.nasdaq.com/articles/the-bank-of-new-york-mellon-corp.-q4-adjusted-earnings-beat-estimates-2021-01-20
138,"The Bank of New York Mellon Corporation (NYSE:BK) Just Reported Full-Year 
Earnings: Have Analysts Changed Their Mind On The Stock?",1 month ago,https://www.nasdaq.com/articles/the-bank-of-new-york-mellon-corporation-nyse%3Abk-just-reported-full-year-earnings%3A-have
139,BNY Mellon to Speak at the 22nd Annual Credit Suisse Virtual ...,1 month ago,https://www.prnewswire.com/news-releases/bny-mellon-to-speak-at-the-22nd-annual-credit-suisse-virtual-financial-services-forum-301220611.html
140,Realignment of Mellon Investments Corp.'s capabilities by ...,1 month ago,https://www.bizjournals.com/pittsburgh/news/2021/02/11/bnymellon-realigns-investment-management.html
141,BNY Mellon Investment Management Launches BNY Mellon ...,"May 21, 2020",https://www.prnewswire.com/news-releases/bny-mellon-investment-management-launches-bny-mellon-investor-solutions-301063122.html
142,Why I Sold Bank Of New York Mellon,"Sep 23, 2020",https://seekingalpha.com/article/4375990-why-i-sold-bank-of-new-york-mellon
143,The Bank of New York Mellon Corporation (NYSE:BK) Looks ...,"Oct 22, 2020",https://simplywall.st/stocks/us/diversified-financials/nyse-bk/bank-of-new-york-mellon/news/the-bank-of-new-york-mellon-corporation-nysebk-looks-like-a-good-stock-and-its-going-ex-dividend-soon
144,BNY Mellon Stock Has A 25% Upside,"Aug 26, 2020",https://www.forbes.com/sites/greatspeculations/2020/08/26/bny-mellon-stock-has-a-25-upside/
145,BNY Mellon to Speak at the Goldman Sachs 2020 US ...,"Dec 2, 2020",https://www.prnewswire.com/news-releases/bny-mellon-to-speak-at-the-goldman-sachs-2020-us-financial-services-conference-301185089.html
146,There's A Lot To Like About Bank of New York Mellon's (NYSE ...,1 month ago,https://simplywall.st/stocks/us/diversified-financials/nyse-bk/bank-of-new-york-mellon/news/theres-a-lot-to-like-about-bank-of-new-york-mellons-nysebk-u
147,The Bank of New York Mellon Corporation (NYSE:BK) Yearly ...,1 month ago,https://simplywall.st/stocks/us/diversified-financials/nyse-bk/bank-of-new-york-mellon/news/the-bank-of-new-york-mellon-corporation-nysebk-yearly-result
148,BNY Mellon Announces Pricing of Public Offering of $582.5 ...,"Oct 26, 2020",https://www.prnewswire.com/news-releases/bny-mellon-announces-pricing-of-public-offering-of-582-5-million-of-depositary-shares-representing-interests-in-preferred-stock-301159969.html
149,Bank of New York Mellon : Cautionary statement,"Dec 28, 2020",https://www.marketscreener.com/quote/stock/BANK-OF-NEW-YORK-MELLON-C-11848/news/Bank-of-New-York-Mellon-nbsp-Cautionary-statement-32093268/
150,BNY Mellon Wealth Management Appoints Vincent Hayes as ...,"Dec 9, 2020",https://www.prnewswire.com/news-releases/bny-mellon-wealth-management-appoints-vincent-hayes-as-head-of-global-family-office-301189311.html
151,The Bank of New York Mellon (BK): Were Hedge Funds Right About Cashing Out?,"Oct 26, 2020",https://finance.yahoo.com/news/bank-york-mellon-bk-were-200130431.html
152,Bank of New York Mellon and Wells Fargo Name New CFOs,"Jul 21, 2020",https://www.thestreet.com/investing/bny-mellon-and-wells-fargo-name-new-chief-financial-officers
153,BNY Mellon scoops up new head of consultant relations,"Jan 5, 2021",https://www.pionline.com/money-management/bny-mellon-scoops-new-head-consultant-relations
154,First Eagle is Betting on Bank of New York Mellon (BK) Stock,"Oct 30, 2020",https://finance.yahoo.com/news/first-eagle-betting-bank-york-184108094.html
155,BNY Mellon Investment Management Announces Dawn Tutje ...,"Jan 11, 2021",https://www.prnewswire.com/news-releases/bny-mellon-investment-management-announces-dawn-tutje-as-the-new-head-of-financial-institutions-group-in-north-america-301202793.html
156,P/E Ratio Insights for Bank of New York Mellon,"Jan 12, 2021",https://www.benzinga.com/news/earnings/21/01/19123985/pe-ratio-insights-for-bank-of-new-york-mellon
157,Presidents Barack Obama- George W. Bush- Bill Clinton and ...,3 days ago,https://www.prnewswire.com/news-releases/presidents-barack-obama-george-w-bush-bill-clinton-and-jimmy-carter-and-first-ladies-michelle-obama-laura-bush-hillary-clinton-and-rosalynn-carter-join-the-ad-council-and-covid-collaboratives-national-covid-19-vaccine-educa-301245180.html
158,Is The Bank of New York Mellon Corporation (BK) A Good Stock To Buy?,"Aug 31, 2020",https://finance.yahoo.com/news/bank-york-mellon-corporation-bk-023733725.html
159,BNY Mellon's MarginConnect Completes Non-Cleared ...,"Nov 12, 2020",https://www.prnewswire.com/news-releases/bny-mellons-marginconnect-completes-non-cleared-derivatives-workflow-for-buy-side-301171093.html
160,BNY Mellon Wealth Management Adds Senior Client ...,1 month ago,https://www.prnewswire.com/news-releases/bny-mellon-wealth-management-adds-senior-client-strategist-in-newport-beach-ca-301221027.html
161,Which Custody Bank Stock Will Pay Better: State Street or BNY Mellon?,"May 4, 2020",https://www.forbes.com/sites/greatspeculations/2020/05/04/which-custody-bank-stock-will-pay-better-state-street-or-bny-mellon/
162,BNY Mellon Wealth Management Announces Laura Kaplan ...,"Dec 14, 2020",https://www.prnewswire.com/news-releases/bny-mellon-wealth-management-announces-laura-kaplan-as-market-president-in-miami-fl-301192158.html
163,Ex-BNY Mellon Exec Says He Was Illegally Fired for ...,"Apr 23, 2020",https://www.law.com/corpcounsel/2020/04/23/ex-bny-mellon-exec-says-he-was-illegally-fired-for-reporting-legal-issue-to-in-house-counsel/
164,BNY Mellon imposing 40-hour workweek- raising minimum ...,"Jul 23, 2020",https://www.post-gazette.com/business/career-workplace/2020/07/23/BNY-Mellon-imposing-40-hour-workweek-raising-minimum-wage/stories/202007230160
165,BNY Mellon opens a new branch in Denmark,"Dec 1, 2020",https://www.globalcustodian.com/the-bank-of-new-york-mellon-opens-a-new-branch-in-denmark/
166,BNY Mellon Announces Redemption of 23-300-000 ...,"Nov 4, 2020",https://www.prnewswire.com/news-releases/bny-mellon-announces-redemption-of-23-300-000-depositary-shares-each-representing-a-14-000th-interest-in-a-share-of-its-series-c-noncumulative-perpetual-preferred-stock-301166432.html
167,BNY Mellon and GTreasury Collaborate to Help Clients ...,"Sep 24, 2020",https://www.prnewswire.com/news-releases/bny-mellon-and-gtreasury-collaborate-to-help-clients-manage-and-invest-cash-301136851.html
168,"The Bank Of New York Mellon To Present At Barclays Global Conference; 
Webcast At 7:30 AM ET","Sep 15, 2020",https://www.nasdaq.com/articles/the-bank-of-new-york-mellon-to-present-at-barclays-global-conference-webcast-at-7%3A30-am-et
169,"BNY Mellon Adds Natural Language Tech for Asset Managers- Clients: Tech 
Roundup","May 5, 2020",https://www.thinkadvisor.com/2020/05/05/bny-mellon-adds-natural-language-tech-for-asset-managers-clients-tech-roundup/
170,PRESS DIGEST- New York Times business news - March 9,5 days ago,https://finance.yahoo.com/news/press-digest-york-times-business-063629171.html
171,The Bank of New York Mellon Corporation (NYSE:BK) Third ...,"Oct 19, 2020",https://simplywall.st/stocks/us/diversified-financials/nyse-bk/bank-of-new-york-mellon/news/the-bank-of-new-york-mellon-corporation-nysebk-third-quarter-results-just-came-out-heres-what-analysts-are-forecasting-for-next-year
172,BNY Mellon Wealth Management Names Michael Dawkins as ...,"Oct 15, 2020",https://www.prnewswire.com/news-releases/bny-mellon-wealth-management-names-michael-dawkins-as-market-president-in-atlanta-ga-301153038.html
173,"What Type Of Shareholders Make Up The Bank of New York Mellon Corporation's 
(NYSE:BK) Share Registry?","Aug 10, 2020",https://finance.yahoo.com/news/type-shareholders-bank-york-mellon-131257564.html
174,Bank of Åland Plc: Managers' Transactions (Erikslund),5 days ago,https://finance.yahoo.com/news/bank-land-plc-managers-transactions-083000615.html
175,"The Bank of New York Mellon Corporation Just Recorded A 17% EPS Beat: 
Here's What Analysts Are Forecasting Next","May 10, 2020",https://finance.yahoo.com/news/bank-york-mellon-corporation-just-124045161.html
176,Exec Rejoins BNY Mellon To Lead International Wealth ...,"May 6, 2020",https://www.fa-mag.com/news/bny-mellon-taps-myriam-soto-to-lead-international-wealth-planning-55601.html
177,BNY Mellon: What’s Next After 40% Rally?,"Jun 18, 2020",https://www.forbes.com/sites/greatspeculations/2020/06/18/bny-mellon-whats-next-after-40-rally/
178,Trust & Processing Banks 3Q20 Results Benefit from Higher ...,"Oct 27, 2020",https://www.fitchratings.com/research/banks/trust-processing-banks-3q20-results-benefit-from-higher-auca-aum-27-10-2020
179,"BNY Mellon- State Street raised to Buy by Deutsche Bank on market- rates 
outlook","Nov 11, 2020",https://seekingalpha.com/news/3634904-bny-mellon-state-street-raised-to-buy-deutsche-bank-on-market-rates-outlook
180,The Bank of New York Mellon Corporation (NYSE:BK) Insiders ...,"Nov 17, 2020",https://simplywall.st/stocks/us/diversified-financials/nyse-bk/bank-of-new-york-mellon/news/the-bank-of-new-york-mellon-corporation-nysebk-insiders-have
181,Stocks I Bought On The Dip: Bank Of New York Mellon,"Jul 24, 2020",https://seekingalpha.com/article/4360757-stocks-i-bought-on-dip-bank-of-new-york-mellon
182,BNY Mellon Launches New Data and Analytics Solutions ...,"Jun 25, 2020",https://www.prnewswire.com/news-releases/bny-mellon-launches-new-data-and-analytics-solutions-offerings-collaborates-with-microsoft-to-build-solutions-on-microsoft-azure-301083452.html
183,"Guardian Capital Group Limited to Acquire BNY Mellon’s Canadian Wealth 
Management Business","Dec 16, 2020",https://finance.yahoo.com/news/guardian-capital-group-limited-acquire-143000063.html
184,BNY Mellon Worker Says Anti-LGBTQ Religious View Got Her ...,"Jan 11, 2021",https://news.bloomberglaw.com/daily-labor-report/bny-mellon-worker-says-anti-lgbtq-religious-view-got-her-fired
185,How Much Did Bank of New York Mellon's(NYSE:BK ...,"Aug 21, 2020",https://simplywall.st/stocks/us/diversified-financials/nyse-bk/bank-of-new-york-mellon/news/how-much-did-bank-of-new-york-mellonsnysebk-shareholders-earn-from-share-price-movements-over-the-last-three-years
186,BNY Mellon Wealth Management Names Christine Calderon ...,"Sep 8, 2020",https://www.prnewswire.com/news-releases/bny-mellon-wealth-management-names-christine-calderon-as-client-strategist-in-chicago-il-301125579.html
187,Bank of New York Mellon Makes Interim CEO Permanent,"Mar 31, 2020",https://www.fool.com/investing/2020/03/31/bank-of-new-york-mellon-makes-interim-ceo-permanen.aspx
188,If You Had Bought Bank of New York Mellon's (NYSE:BK ...,"Dec 15, 2020",https://simplywall.st/stocks/us/diversified-financials/nyse-bk/bank-of-new-york-mellon/news/if-you-had-bought-bank-of-new-york-mellons-nysebk-shares-thr
189,BNY Mellon Report Assesses the Impact of the COVID-19 ...,"Oct 8, 2020",https://www.prnewswire.com/news-releases/bny-mellon-report-assesses-the-impact-of-the-covid-19-pandemic-on-capital-markets-301148427.html
190,Fitch Affirms BNY Mellon US Dollar Liquidity Fund at 'AAAmmf',"Nov 11, 2020",https://www.fitchratings.com/research/fund-asset-managers/fitch-affirms-bny-mellon-us-dollar-liquidity-fund-at-aaammf-11-11-2020
191,BNY Mellon links with NCB Capital for Saudi Arabia asset ...,"Oct 6, 2020",https://www.pionline.com/asset-servicing/bny-mellon-links-ncb-capital-saudi-arabia-asset-servicing
192,Fitch Affirms BNY Mellon's Commercial Servicer Ratings,"Nov 6, 2020",https://www.fitchratings.com/research/structured-finance/fitch-affirms-bny-mellon-commercial-servicer-ratings-06-11-2020
193,Ralph Izzo Elected to the Board of Directors of BNY Mellon,"Aug 11, 2020",https://www.prnewswire.com/news-releases/ralph-izzo-elected-to-the-board-of-directors-of-bny-mellon-301110367.html
194,BNY Mellon Alcentra Global Credit Income 2024 Target Term ...,"Dec 14, 2020",https://www.businesswire.com/news/home/20201214005840/en/BNY-Mellon-Alcentra-Global-Credit-Income-2024-Target-Term-Fund-Inc.-Declares-Monthly-Distribution
195,Forget Wells Fargo: Bank of New York Mellon Is a Better Bank Stock,"Apr 12, 2020",https://www.fool.com/investing/2020/04/12/forget-wells-fargo-bank-of-new-york-mellon-better.aspx
196,Bank of New York Mellon names new CEO - New York ...,"Mar 30, 2020",https://www.bizjournals.com/newyork/news/2020/03/30/bank-of-new-york-mellon-names-new-ceo.html
197,BNY Mellon High Yield Strategies Fund Announces Change ...,"Nov 30, 2020",https://www.businesswire.com/news/home/20201130005960/en/BNY-Mellon-High-Yield-Strategies-Fund-Announces-Change-in-Leverage-Providers
198,Philadelphia to dim lights to make it safer for birds in flight,6 hours ago,https://wcti12.com/news/offbeat/philadelphia-to-dim-lights-to-make-it-safer-for-birds-in-flight
199,Most Powerful Women to Watch: Paulette Mullings Bradnock ...,"Sep 29, 2020",https://www.americanbanker.com/news/most-powerful-women-to-watch-for-2020-paulette-mullings-bradnock-bny-mellon
