,Title,Time,Link
0,HSBC Bosses Try to Quell Banker Anger Over Cuts to Bonuses,3 days ago,https://www.bloomberg.com/news/articles/2021-03-11/hsbc-bosses-try-to-quell-investment-banker-ire-over-bonus-cuts
1,HSBC's horrible bonuses have come back to haunt it,2 days ago,https://www.efinancialcareers.com/news/2021/03/hsbc-bonuses-objections
2,HSBC plans to phase out coal financing by 2040,3 days ago,https://www.bbc.com/news/business-56352203
3,"Pandemic saves Goldman- HSBC more than $1bn on bankers' travel and 
entertainment",2 days ago,https://www.fnlondon.com/articles/the-pandemic-saved-banks-more-than-1bn-on-high-flyers-travel-and-entertainment-20210312
4,"HSBC Encouraging Those I-Bankers Who Can To Leave And The Rest To Just 
Slack Off",2 days ago,https://dealbreaker.com/2021/03/hsbc-bonus-cuts
5,Investors turn up heat on HSBC to phase out fossil fuel funding,3 days ago,https://www.aljazeera.com/economy/2021/3/11/investors-turn-up-heat-on-hsbc-to-phase-out-fossil-fuel-funding
6,Huawei’s Meng takes HSBC to court in Hong Kong to seek bank’s papers,2 weeks ago,https://www.scmp.com/tech/tech-war/article/3123310/huaweis-cfo-meng-wanzhou-takes-hsbc-court-hong-kong-seek-access-banks
7,HSBC pays dividends again after beating estimates on 2020 profit,3 weeks ago,https://www.cnbc.com/2021/02/23/hsbc-reports-fourth-quarter-full-year-2020-earnings.html
8,HSBC to announce exit from U.S. retail banking- reshuffles top jobs,3 weeks ago,https://www.cnbc.com/2021/02/22/hsbc-to-announce-exit-from-us-retail-banking-reshuffles-top-jobs.html
9,Big banks will need much less office space in the future,2 weeks ago,https://www.cnn.com/2021/02/24/business/hsbc-lloyds-london-office/index.html
10,HSBC Dodges Public Climate Spat With Own Shareholder ...,3 days ago,https://www.bloomberg.com/news/articles/2021-03-11/hsbc-proposes-climate-resolution-with-coal-phase-out-target
11,HSBC toughens stance on fossil fuel funding after shareholder ...,3 days ago,https://wsau.com/2021/03/10/hsbc-toughens-stance-on-fossil-fuel-funding-after-shareholder-heat/
12,HSBC avoids revolt by investors pressing for cut in fossil fuel ...,Blog,https://www.ft.com/content/3f976312-532d-4a4b-b189-8ab98c469827
13,HSBC Bank's presence in Buffalo still solid despite decisions ...,1 week ago,https://www.bizjournals.com/buffalo/news/2021/03/05/hsbc-bank-s-presence-in-buffalo.html
14,Either Huawei or HSBC is lying as Meng case moves to Hong ...,2 days ago,https://www.lightreading.com/security/either-huawei-or-hsbc-is-lying-as-meng-case-moves-to-hong-kong/d/d-id/768031
15,Chase hires ex-HSBC exec Jeremy Balkin to lead wholesale ...,4 days ago,https://www.paymentssource.com/news/chase-hires-ex-hsbc-exec-jeremy-balkin-to-lead-wholesale-payments-innovation
16,HSBC Germany Head Von Schmettow to Be Replaced by ...,3 days ago,https://www.bloomberg.com/news/articles/2021-03-11/hscb-germany-head-von-schmettow-to-be-replaced-by-salsano
17,HSBC now offers Mac-friendly choice scheme,1 week ago,https://www.computerworld.com/article/3610689/hsbc-now-offers-mac-friendly-choice-scheme.html
18,HSBC Asset Management adds head of ETF strategy,3 days ago,https://www.pionline.com/money-management/hsbc-asset-management-adds-head-etf-strategy
19,HSBC confirms plan to sell US retail business,3 weeks ago,https://www.spglobal.com/marketintelligence/en/news-insights/latest-news-headlines/hsbc-confirms-plan-to-sell-us-retail-business-62801265
20,HSBC confirms plan to sell US retail business,3 weeks ago,https://www.spglobal.com/marketintelligence/en/news-insights/latest-news-headlines/hsbc-confirms-plan-to-sell-us-retail-business-62801265
21,HSBC Ratings Placed Under Review for Downgrade by Moody's,5 days ago,https://www.nasdaq.com/articles/hsbc-ratings-placed-under-review-for-downgrade-by-moodys-2021-03-09
22,HSBC Banker Knew About Dealings With Iran- Meng's ...,2 weeks ago,https://www.bloomberg.com/news/articles/2021-03-02/hsbc-banker-knew-about-dealings-with-iran-meng-s-defense-argues
23,HSBC to shrink its office footprint amid shift to WFH,2 weeks ago,https://therealdeal.com/national/2021/02/24/hsbc-to-shrink-its-office-footprint-amid-shift-to-wfh/
24,"Despite Interest Rate Headwinds- HSBC Stock Is Likely To Beat Consensus In 
Q4",3 weeks ago,https://www.forbes.com/sites/greatspeculations/2021/02/22/despite-interest-rate-headwinds-hsbc-stock-is-likely-to-beat-consensus-in-q4/
25,HSBC Holdings (HSBC) Aims Expansion in Asia- Hires New Staff,2 weeks ago,https://finance.yahoo.com/news/hsbc-holdings-hsbc-aims-expansion-152203033.html
26,JPMorgan Taps HSBC Innovation Head To Lead FinTech Division,4 days ago,https://www.pymnts.com/personnel/2021/jpmorgan-taps-hsbc-innovation-head-lead-fintech-division/
27,HSBC U.S. Wealth- Personal-Banking Head Sanchez to ...,3 weeks ago,https://www.bloomberg.com/news/articles/2021-02-23/hsbc-u-s-wealth-personal-banking-head-sanchez-to-leave-lender
28,Huawei- HSBC in Hong Kong court over Meng extradition papers,2 days ago,https://www.scmp.com/tech/tech-war/article/3125229/hong-kong-court-hears-meng-wanzhous-application-access-hsbc-documents
29,HSBC rises on report it's about to exit U.S. retail as FTSE 100 reverses,3 weeks ago,https://www.marketwatch.com/story/hsbc-rises-on-report-its-about-to-exit-u-s-retail-as-ftse-100-reverses-11613994689
30,Huawei- HSBC in Hong Kong court over Meng extradition papers,2 days ago,https://www.scmp.com/tech/tech-war/article/3125229/hong-kong-court-hears-meng-wanzhous-application-access-hsbc-documents
31,Who are the highest earning bankers at HSBC in Hong Kong?,5 days ago,https://www.efinancialcareers.com/news/2021/03/who-are-the-highest-earning-bankers-at-hsbc-in-hong-kong
32,A massive overhaul is rocking HSBC. Here's what you need to ...,2 weeks ago,https://www.fnlondon.com/articles/a-massive-overhaul-is-rocking-hsbc-heres-what-you-need-to-know-20210224
33,UK shares inch higher; HSBC- AstraZeneca cap gains,3 days ago,https://www.kitco.com/news/2021-03-11/UK-shares-inch-higher-HSBC-AstraZeneca-cap-gains.html
34,HSBC- Barclays challenged over bond linked to Vietnamese ...,2 weeks ago,https://www.reuters.com/article/instant-article/idINKBN2AO14D
35,HSBC Global Asset Management Announces Changes to ...,1 week ago,https://www.businesswire.com/news/home/20210305005540/en/HSBC-Global-Asset-Management-Announces-Changes-to-Some-of-Its-Funds
36,HSBC Women's World Championship set for April return,6 days ago,https://www.lpga.com/news/2021/hsbc-womens-world-championship-set-for-april-return
37,HSBC BANK PLC - Form 8.5 (EPT/RI) - TalkTalk Telecom Group plc,2 days ago,https://finance.yahoo.com/news/hsbc-bank-plc-form-8-111100665.html
38,"HSBC Bank A.S. (Turkey) -- Moody's announces completion of a periodic 
review of ratings of HSBC Bank A.S. (Turkey)",2 days ago,https://finance.yahoo.com/news/hsbc-bank-turkey-moodys-announces-145007107.html
39,HSBC Among Top Bank Share Gainers in Asia on Reflation Bets,4 weeks ago,https://www.bloomberg.com/news/articles/2021-02-16/hsbc-among-top-bank-share-gainers-in-asia-on-reflation-bets
40,Huawei's CFO Takes HSBC to Hong Kong Court to Gain ...,2 weeks ago,https://www.bloomberg.com/news/articles/2021-02-26/huawei-s-cfo-takes-hsbc-to-court-in-hong-kong-to-gain-documents
41,HSBC launches £15bn fund to support COVID recovery,4 days ago,https://au.finance.yahoo.com/news/hsbc-sme-fund-2021-15-bn-covid-19-disruptive-entrepreneurship-000132839.html
42,HSBC launches FX hedging analytics tool for buy-side - The ...,6 days ago,https://www.thetradenews.com/hsbc-launches-fx-hedging-analytics-tool-for-buy-side/
43,UPDATE: HSBC Global Asset Management Announces ...,2 weeks ago,https://www.businesswire.com/news/home/20210224006113/en/UPDATE-HSBC-Global-Asset-Management-Announces-Change-to-the-HSBC-Emerging-Markets-Pooled-Fund
44,HSBC Holdings plc (HSBC) Ex-Dividend Date Scheduled for March 11- 2021,4 days ago,https://www.nasdaq.com/articles/hsbc-holdings-plc-hsbc-ex-dividend-date-scheduled-for-march-11-2021-2021-03-10
45,HSBC launches new regional focused SME lending fund for businesses to thrive,2 days ago,https://www.taxassist.co.uk/resources/news/hsbc-launches-new-regional-focused-sme-lending-fund-for-businesses-to-thrive
46,HSBC bosses try to quell banker anger over bonus cuts,2 days ago,https://www.straitstimes.com/business/banking/hsbc-bosses-try-to-quell-banker-anger-over-bonus-cuts
47,HSBC's interns received an incomprehensible object in the post,1 week ago,https://www.efinancialcareers.com/news/2021/03/hsbc-intern-gifts
48,HSBC BANK PLC - Form 8.5 (EPT/RI) - Calisen PLC,3 days ago,https://www.globenewswire.com/news-release/2021/03/11/2191105/0/en/HSBC-BANK-PLC-Form-8-5-EPT-RI-Calisen-PLC.html
49,HSBC launches luxury index for wealth clients in Malaysia,16 hours ago,https://www.nst.com.my/business/2021/03/673715/hsbc-launches-luxury-index-wealth-clients-malaysia
50,HSBC BANK PLC - Form 8.5 (EPT/RI) - Calisen PLC,3 days ago,https://www.globenewswire.com/news-release/2021/03/11/2191105/0/en/HSBC-BANK-PLC-Form-8-5-EPT-RI-Calisen-PLC.html
51,HSBC launches luxury index for wealth clients in Malaysia,16 hours ago,https://www.nst.com.my/business/2021/03/673715/hsbc-launches-luxury-index-wealth-clients-malaysia
52,HSBC: Rate Sensitivity And Improving Shareholder Returns,6 days ago,https://seekingalpha.com/article/4412218-hsbc-improving-shareholder-returns
53,"Asia-Pacific stocks mixed as investors watch tech shares; HSBC earnings 
beat expectations",3 weeks ago,https://www.cnbc.com/2021/02/23/asia-stocks-technology-shares-japan-markets-closed-hsbc-earnings-currencies-oil.html
54,"HSBC Bank (China) Company Limited -- Moody's places HSBC Bank (China) on 
review for downgrade; affirms Hang Seng Bank (China)'s deposit ratings with 
stable outlook",4 days ago,https://finance.yahoo.com/news/hsbc-bank-china-company-limited-124607351.html
55,Huawei confirms exec seeking HSBC records in Hong Kong court,3 days ago,https://au.finance.yahoo.com/news/huawei-confirms-exec-seeking-hsbc-042308305.html
56,Huawei CFO Meng Wanzhou loses lawsuit against HSBC in the UK,1 month ago,https://qz.com/1972171/huawei-cfo-meng-wanzhou-sues-hsbc-in-the-uk/
57,HSBC fraud helpline's 20-hour wait 'disgraceful',3 weeks ago,https://finance.yahoo.com/news/hsbc-fraud-helplines-20-hour-015837118.html
58,Roaring Reflation Forces HSBC- BlackRock- Axa to Drop ...,2 weeks ago,https://www.bloomberg.com/news/articles/2021-02-24/roaring-reflation-forces-hsbc-blackrock-axa-to-drop-bond-bets
59,Bonus gloom grows at HSBC,4 weeks ago,https://www.efinancialcareers.com/news/2021/02/bonus-gloom-grows-at-hsbc
60,HSBC appoints new global head of alternative investments,2 days ago,https://www.assetservicingtimes.com/assetservicesnews/peoplemovesarticle.php?article_id=11628&navigationaction=peoplemovesnews&newssection=People%20Moves
61,Interesting HSBC Put And Call Options For April 30th,3 days ago,https://www.nasdaq.com/articles/interesting-hsbc-put-and-call-options-for-april-30th-2021-03-11
62,HSBC let me down after cruise company collapsed,2 weeks ago,https://www.theguardian.com/money/2021/mar/02/hsbc-cruise-company-holidays
63,Paris climate target will require $100 trillion investment: HSBC chief,2 weeks ago,https://www.reuters.com/article/us-ceraweek-hsbc-investment-idUSKCN2AU2BR
64,HSBC bankers fret as popular colleagues leave and bank ...,3 weeks ago,https://www.efinancialcareers.com/news/2021/02/hsbc-bankers-leaving-in-the-u.s
65,Canara HSBC Oriental Bank of Commerce Life Insurance ...,5 days ago,https://www.businesswire.com/news/home/20210309005080/en/Canara-HSBC-Oriental-Bank-of-Commerce-Life-Insurance-Enables-Work-from-Anywhere-with-Citrix%C2%AE
66,HSBC announces reshuffle of senior sustainable trade finance ...,4 days ago,https://www.gtreview.com/news/on-the-move/hsbc-announces-reshuffle-of-senior-sustainable-trade-finance-execs/
67,HSBC to slash jobs at London equities trading division,2 weeks ago,https://sports.yahoo.com/hsbc-to-slash-jobs-staff-workers-executivies-shakeup-london-equities-unit-132608221.html
68,Breakingviews - Capital Calls: HSBC plans to shrink offices- again,3 weeks ago,https://www.reuters.com/article/us-global-finance-breakingviews-idUSKBN2AN1MU
69,HSBC banks on NRI- wealth management in fresh retail charge,3 days ago,https://economictimes.indiatimes.com/industry/banking/finance/banking/hsbc-banks-on-nri-wealth-management-in-fresh-retail-charge/articleshow/81451756.cms
70,"HSBC's taipan steps up with proposal to help Hong Kong's youth study- find 
jobs or start businesses in Greater Bay Area",1 week ago,https://finance.yahoo.com/news/hsbcs-taipan-steps-proposal-help-093000267.html
71,"JPMorgan Chase & Co Appoints Ex- HSBC Holdings Exec Jeremy Balkin as its 
Head of Fintech and Innovation for Wholesale Payments",2 days ago,https://www.crowdfundinsider.com/2021/03/173090-jpmorgan-chase-co-appoints-ex-hsbc-holdings-exec-jeremy-balkin-as-its-head-of-fintech-and-innovation-for-wholesale-payments/
72,HSBC Malaysia launches Solactive Luxury Dynamic Factors ...,16 hours ago,https://www.theedgemarkets.com/article/hsbc-malaysia-launches-solactive-luxury-dynamic-factors-index-wealth-clients
73,HSBC : Coronavirus Outbreak at Fitness Centers Roils Hong ...,3 days ago,https://www.marketscreener.com/quote/stock/HSBC-HOLDINGS-PLC-16896790/news/HSBC-nbsp-Coronavirus-Outbreak-at-Fitness-Centers-Roils-Hong-Kong-s-Finance-Industry-32661350/
74,HSBC pushed to vote on aggressive climate change resolution,2 days ago,https://global.chinadaily.com.cn/a/202103/12/WS604a7b12a31024ad0baae9f6.html
75,HSBC- JPMorgan among banks dipping into crypto and ...,3 weeks ago,https://www.fnlondon.com/articles/hsbc-jpmorgan-among-banks-dipping-into-crypto-blockchain-or-both-heres-the-list-20210218
76,HSBC Private Bank selection head given expanded role,1 week ago,https://citywireselector.com/news/hsbc-private-bank-selection-head-given-expanded-role/a1474931
77,HSBC managing director resurfaces at Coinbase,2 weeks ago,https://www.efinancialcareers.com/news/2021/02/hsbc-managing-director-resurfaces-at-coinbase
78,Hong Kong Cards and Payments Market Outlook to 2024 ...,5 days ago,https://www.globenewswire.com/news-release/2021/03/09/2189311/0/en/Hong-Kong-Cards-and-Payments-Market-Outlook-to-2024-Featuring-HSBC-Bank-of-China-Bank-of-East-Asia-China-UnionPay-and-AliPayHK.html
79,HSBC first to use Corda enterprise blockchain on Google Cloud,2 weeks ago,https://ledgerinsights.com/hsbc-first-to-use-corda-enterprise-blockchain-on-google-cloud/
80,Mining- energy stocks push FTSE 100 higher; HSBC slides,3 weeks ago,https://www.reuters.com/article/britain-stocks-idUSL4N2KT1NR
81,Correction to HSBC Articles and Mentions in Highlights ...,1 week ago,https://www.morningstar.com/news/dow-jones/2021030415659/correction-to-hsbc-articles-and-mentions-in-highlights-briefing-on-feb-23
82,Former HSBC Exec and Blockchain Expert Diana Biggs Joins Valour as CEO,1 month ago,https://finance.yahoo.com/news/former-hsbc-exec-blockchain-expert-135844924.html
83,HSBC Global Equity Climate Change FoF NFO: A green ...,1 day ago,https://www.thehindubusinessline.com/portfolio/mutual-funds/hsbc-global-equity-climate-change-fof-nfo-a-green-investment-strategy/article34061099.ece
84,"Huawei sues HSBC in Hong Kong for documents US 'wilfully withheld' in 
extradition request",2 days ago,https://uk.news.yahoo.com/huawei-sues-hsbc-hong-kong-131500899.html
85,Minerva Luxembourg SA Announces That HSBC Securities ...,2 weeks ago,https://www.prnewswire.com/news-releases/minerva-luxembourg-sa-announces-that-hsbc-securities-usa-inc-has-launched-a-tender-offer-for-any-and-all-of-the-6-500-senior-notes-due-2026-issued-by-minerva-luxembourg-sa-301237354.html
86,This week's hires- exits- promotions- and resignations on Wall ...,1 day ago,https://www.businessinsider.com/wall-street-hires-exits-promotions-resignations-jpmorgan-hsbc-kkr-goldman-2021-3
87,HSBC : How Does My International Company Do Banking In ...,6 days ago,https://www.marketscreener.com/quote/stock/HSBC-HOLDINGS-PLC-16896790/news/HSBC-nbsp-How-Does-My-International-Company-Do-Banking-In-The-U-S--32630961/
88,West Side Rag » Openings & Closings: Hachi Maki- Le Pain ...,1 month ago,https://www.westsiderag.com/2021/02/13/openings-closings-hachi-maki-le-pain-quotidien-hsbc
89,2 reasons I'd buy at the current HSBC share price,2 days ago,https://www.fool.co.uk/investing/2021/03/12/2-reasons-id-buy-at-the-current-hsbc-share-price/
90,2 reasons I'd buy at the current HSBC share price,2 days ago,https://www.fool.co.uk/investing/2021/03/12/2-reasons-id-buy-at-the-current-hsbc-share-price/
91,HSBC promotes head of private markets to lead global ...,2 days ago,https://www.globalcustodian.com/hsbc-promotes-head-of-private-markets-to-lead-global-alternatives-business/
92,Kraton Corporation Announces Global Price Increase For All ...,6 days ago,https://www.fbherald.com/news/state/kraton-corporation-announces-global-price-increase-for-all-hsbc-products/article_140359a0-f4b6-5d5d-9d6a-006d265d6b4c.html
93,JD com : HSBC Adjusts JD.com's Price Target to $108 From ...,2 days ago,https://www.marketscreener.com/quote/stock/JD-COM-INC-16538052/news/JD-com-nbsp-HSBC-Adjusts-JD-com-s-Price-Target-to-108-From-103-Maintains-Buy-Rating-32672573/
94,Private Equity Jobs of the Week: Morgan Stanley- HSBC and ...,3 weeks ago,https://www.pehub.com/private-equity-jobs-of-the-week-morgan-stanley-hsbc-and-castleforge-are-hiring/
95,Family Office Market Top Growing Factors By Key Companies ...,1 day ago,https://neighborwebsj.com/uncategorized/4629560/family-office-market-top-growing-factors-by-key-companies-like-hsbc-private-bank-citi-private-bank-northern-trust-bessemer-trust-bny-mellon-wealth-management/
96,Bank-FinTech Partnerships Market Ravishing Revenues by ...,2 days ago,https://ksusentinel.com/2021/03/12/bank-fintech-partnerships-market-ravishing-revenues-by-2028-firstbank-flutterwave-flux-hsbc-10x-future-technologies-abra-access-bank-american-express-banco-bradesco-banco-do-brasil-barclay/
97,"HSBC warning over dangerous spam messages with customers told to block 
suspicious numbers",4 days ago,https://www.hulldailymail.co.uk/news/hull-east-yorkshire-news/hsbc-warning-dangerous-spam-messages-5109205
98,HSBC issues US$1.98b convertible securities,1 week ago,https://www.thestandard.com.hk/breaking-news/section/2/166599/HSBC-issues-US$1.98b-convertible-securities
99,"Future Prospects of Hydrogenated Styrenic Block Copolymer (HSBC) Market: 
in-depth Analysis on Key Players and Their Future Plans: Kraton Performance 
Polymers- TSRC- LCY Chemical Corp- Eastman Chemical Company",2 days ago,https://www.mccourier.com/future-prospects-of-hydrogenated-styrenic-block-copolymer-hsbc-market-in-depth-analysis-on-key-players-and-their-future-plans-kraton-performance-polymers-tsrc-lcy-chemical-corp-eastman-chemical/
100,"HSBC warning over dangerous spam messages with customers told to block 
suspicious numbers",4 days ago,https://www.hulldailymail.co.uk/news/hull-east-yorkshire-news/hsbc-warning-dangerous-spam-messages-5109205
101,"Future Prospects of Hydrogenated Styrenic Block Copolymer (HSBC) Market: 
in-depth Analysis on Key Players and Their Future Plans: Kraton Performance 
Polymers- TSRC- LCY Chemical Corp- Eastman Chemical Company",2 days ago,https://www.mccourier.com/future-prospects-of-hydrogenated-styrenic-block-copolymer-hsbc-market-in-depth-analysis-on-key-players-and-their-future-plans-kraton-performance-polymers-tsrc-lcy-chemical-corp-eastman-chemical/
102,Global Finance Lease Market 2021 – HSBC Bank- Sumitomo ...,1 week ago,https://ksusentinel.com/2021/03/03/global-finance-lease-market-2021-hsbc-bank-sumitomo-mitsui-finance-and-leasing-bnp-paribas-leasing-solutions-wells-fargo-equipment-finance-banc-of-america-leasing-capital-llc/
103,HSBC Launches New Service with Biz2Credit to Streamline ...,"Nov 12, 2020",https://www.globenewswire.com/news-release/2020/11/12/2125872/0/en/HSBC-Launches-New-Service-with-Biz2Credit-to-Streamline-Banking-for-Small-Businesses-in-The-U-S.html
104,HSBC Bank Review – Forbes Advisor,"Jul 15, 2020",https://www.forbes.com/advisor/banking/hsbc-bank-review/
105,HSBC to Target Wealth Management in Latest Strategic Shift,1 month ago,https://www.bloomberg.com/news/articles/2021-02-11/hsbc-to-bolster-wealth-management-arm-in-latest-strategic-shift
106,HSBC Introduces New Real-Time Global Payments Tool,"Nov 23, 2020",https://www.pymnts.com/news/banking/2020/hsbc-introduces-new-real-time-global-payments-tool/
107,HSBC to overhaul business model as third-quarter profit tumbles 35%,"Oct 27, 2020",https://www.reuters.com/article/us-hsbc-hldg-results/hsbc-to-overhaul-business-model-as-third-quarter-profit-tumbles-35-idUKKBN27C0EB
108,HSBC May Move Top Executives to Asia to Strengthen Push,1 month ago,https://www.bloomberg.com/news/articles/2021-02-03/hsbc-mulls-moving-top-executives-to-asia-to-strengthen-push
109,Paring Global Ambitions- HSBC May Offload U.S. Consumer ...,"Nov 29, 2020",https://www.bloomberg.com/news/articles/2020-11-29/hsbc-contemplates-complete-exit-from-u-s-retail-banking
110,HSBC to face shareholder heat on fossil fuels in AGM vote,"Jan 10, 2021",https://www.reuters.com/article/uk-hsbc-climate-vote/hsbc-to-face-shareholder-heat-on-fossil-fuels-in-agm-vote-idUKKBN29F0EG
111,HSBC Shareholders Ask Bank to Cut Fossil-Fuel Lending ...,In-Depth,https://www.bloomberg.com/news/articles/2021-01-10/hsbc-shareholders-ask-bank-to-cut-fossil-fuel-lending-exposure
112,State Street doubles down on ESG pledge- while HSBC's ...,"Jan 11, 2021",https://www.bankingdive.com/news/state-street-HSBC-ESG/593121/
113,Exiled Hong Kong legislator calls for action after HSBC bank accounts frozen,"Dec 7, 2020",https://www.theguardian.com/world/2020/dec/07/exiled-hong-kong-legislator-calls-for-inquiry-after-hsbc-freezes-bank-account
114,HSBC's CEO Faces U.K. Questions Over H.K. Account Freezes,1 month ago,https://www.bloomberg.com/news/articles/2021-01-25/hsbc-s-ceo-faces-u-k-questions-over-hong-kong-account-freezes
115,HSBC bet the bank on China. It's in big trouble if tensions escalate,"Aug 5, 2020",https://www.cnn.com/2020/08/05/business/hsbc-china-challenges-intl-hnk/index.html
116,HSBC urged to unfreeze accounts of Hong Kong activist,1 month ago,https://www.theguardian.com/business/2021/feb/08/hsbc-urged-to-unfreeze-accounts-of-hong-kong-activist-china
117,HSBC Weighs Shutting US Retail Banking Unit,"Nov 29, 2020",https://www.pymnts.com/news/banking/2020/hsbc-weighs-shutting-united-states-retail-banking-unit/
118,If HSBC's selling its branches- who's buying?,"Dec 3, 2020",https://www.americanbanker.com/news/if-hsbcs-selling-its-branches-whos-buying
119,HSBC Chairman Gives Hints of Looming Strategy Revamp,1 month ago,https://www.bloomberg.com/news/articles/2021-01-18/hsbc-chairman-gives-hints-of-looming-strategy-revamp
120,HSBC Shares Fall to 25-Year Low on China Fears- Banks ...,"Sep 18, 2020",https://www.bloomberg.com/news/articles/2020-09-18/hsbc-shares-slump-below-level-last-seen-in-2008-financial-crisis
121,HSBC's US retail franchise is for sale and bidders are emerging,"Dec 11, 2020",https://www.crainsnewyork.com/markets/hsbcs-nyc-branches-are-auction-bidders-emerge
122,Is HSBC Stock Still Undervalued?,"Jan 6, 2021",https://www.forbes.com/sites/greatspeculations/2021/01/06/is-hsbc-stock-still-undervalued/
123,HSBC is latest bank to pledge net-zero financed emissions by ...,"Oct 13, 2020",https://www.greenbiz.com/article/hsbc-latest-bank-pledge-net-zero-financed-emissions-mid-century
124,Shares in HSBC rise 10% after China's Ping An raises stake,"Sep 28, 2020",https://www.marketwatch.com/story/shares-in-hsbc-rise-10-after-chinas-ping-an-raises-stake-11601293076
125,HSBC shares fall to 25-year low as fears for China business grow,"Sep 21, 2020",https://www.cnn.com/2020/09/21/investing/hsbc-shares-intl-hnk/index.html
126,"HSBC may have to choose between East and West as China tightens grip on 
Hong Kong","Jul 9, 2020",https://www.cnn.com/2020/07/09/business/hsbc-hong-kong-uk-intl-hnk/index.html
127,HSBC Review: Traditional Banking Options With a Global Reach,1 month ago,https://www.gobankingrates.com/reviews/hsbc-bank/
128,HSBC Paints Grim Outlook In 'Hugely Unpredictable' Times,"Aug 2, 2020",https://www.bloomberg.com/news/articles/2020-08-03/hsbc-misses-estimates-as-turmoil-weighs-on-banking-loan-book
129,HSBC Doubles Down on China With New Greater Bay Area ...,1 month ago,https://www.bloomberg.com/news/articles/2021-02-01/hsbc-doubles-down-on-china-with-new-greater-bay-area-office
130,HSBC Bank USA Appoints Ralph Jardine as Head of Inclusion ...,"Sep 24, 2020",https://www.businesswire.com/news/home/20200924005521/en/HSBC-Bank-USA-Appoints-Ralph-Jardine-as-Head-of-Inclusion-and-Culture
131,Hong Kong Ex-Lawmaker Rejects HSBC Account Freeze Explanation,"Jan 17, 2021",https://www.bloomberg.com/news/articles/2021-01-18/h-k-ex-lawmaker-rejects-hsbc-ceo-s-account-freeze-explanation
132,HSBC Taps Biz2X Platform To Accelerate SMB Credit Approvals,"Nov 12, 2020",https://www.pymnts.com/news/b2b-payments/2020/hsbc-taps-biz2x-platform-to-accelerate-smb-credit-approvals/
133,In Showdown Between China and the West- HSBC Gets Caught in the Middle,"Aug 3, 2020",https://www.nytimes.com/2020/08/03/business/hsbc-china-hong-kong-united-states.html
134,Breakingviews - HSBC breakup will turbocharge CEO’s Asian pivot,"Dec 29, 2020",https://www.reuters.com/article/us-hsbc-hldg-usa-breakingviews/breakingviews-hsbc-breakup-will-turbocharge-ceos-asian-pivot-idUSKBN29401Z
135,"HSBC's Secret Files: The Inside Tale Of What Happened After It Apologized 
For Being Dirty","Sep 21, 2020",https://www.buzzfeednews.com/article/anthonycormier/hsbc-money-laundering-drug-cartels
136,Invest In HSBC Stock For 35% Gains,"Nov 27, 2020",https://www.forbes.com/sites/greatspeculations/2020/11/27/invest-in-hsbc-stock-for-35-gains/
137,HSBC Bank USA Appoints Mark Pittsey Head of Wealth,"Sep 2, 2020",https://www.businesswire.com/news/home/20200902005614/en/HSBC-Bank-USA-Appoints-Mark-Pittsey-Head-of-Wealth
